tweet_id,timestamp,source,text,expanded_urls,rating_numerator,rating_denominator,name,dog_breed,retweet_count,favorite_count,user_count
726887082820554753,2016-05-01 21:32:40+00:00,"<a href=""http://twitter.com/download/iphone"" rel=""nofollow"">Twitter for iPhone</a>",This is Blitz. He's a new dad struggling to cope mentally with the pressures of being a father. Sick shades 10/10 https://t.co/2AVcJ2BZsy,https://twitter.com/dog_rates/status/726887082820554753/photo/1,10.0,10,Blitz,,1448.0,3690.0,8960373.0
726828223124897792,2016-05-01 17:38:46+00:00,"<a href=""http://twitter.com/download/iphone"" rel=""nofollow"">Twitter for iPhone</a>",This is Bloop. He's a Phoenician Winnebago. Tongue is just wow. That box is all he has (tragic). 12/10 would caress https://t.co/DWNrPPXgHA,https://twitter.com/dog_rates/status/726828223124897792/photo/1,12.0,10,Bloop,,961.0,3434.0,8960373.0
726224900189511680,2016-04-30 01:41:23+00:00,"<a href=""http://twitter.com/download/iphone"" rel=""nofollow"">Twitter for iPhone</a>",I'm getting super heckin frustrated with you all sending in non canines like this ostrich. We only rate dogs... 9/10 https://t.co/Rgbni2Ns8z,https://twitter.com/dog_rates/status/726224900189511680/photo/1,9.0,10,,,1095.0,4254.0,8960373.0
725842289046749185,2016-04-29 00:21:01+00:00,"<a href=""http://twitter.com/download/iphone"" rel=""nofollow"">Twitter for iPhone</a>",This is Colby. He's currently regretting all those times he shook your hand for an extra treat. 12/10 https://t.co/vtVHtKFtBH,https://twitter.com/dog_rates/status/725842289046749185/photo/1,12.0,10,Colby,,2544.0,6818.0,8960373.0
725786712245440512,2016-04-28 20:40:11+00:00,"<a href=""http://twitter.com/download/iphone"" rel=""nofollow"">Twitter for iPhone</a>",Say hello to Lillie. She's a Rutabagan Floofem. Poor pupper ate and then passed out. 11/10 relatable af https://t.co/uIdGqug9rw,https://twitter.com/dog_rates/status/725786712245440512/photo/1,11.0,10,Lillie,pupper,1311.0,4011.0,8960373.0
725729321944506368,2016-04-28 16:52:08+00:00,"<a href=""http://twitter.com/download/iphone"" rel=""nofollow"">Twitter for iPhone</a>",This is Lola. She's a Butternut Splishnsplash. They are known to be ferocious af. 12/10 would absolutely still pet https://t.co/adQt5a6TZU,https://twitter.com/dog_rates/status/725729321944506368/photo/1,12.0,10,Lola,,1695.0,5004.0,8960373.0
724983749226668032,2016-04-26 15:29:30+00:00,"<a href=""http://twitter.com/download/iphone"" rel=""nofollow"">Twitter for iPhone</a>",This is Fred-Rick. He dabbles in parkour. The elevation gives him power. 12/10 hopefully visiting a mailbox near you https://t.co/qFqLtudIiD,https://twitter.com/dog_rates/status/724983749226668032/photo/1,12.0,10,Fred,,1238.0,3594.0,8960373.0
724771698126512129,2016-04-26 01:26:53+00:00,"<a href=""http://twitter.com/download/iphone"" rel=""nofollow"">Twitter for iPhone</a>",Nothin better than a doggo and a sunset. 11/10 https://t.co/JlFqOhrHEs,"https://twitter.com/dog_rates/status/724771698126512129/photo/1,https://twitter.com/dog_rates/status/724771698126512129/photo/1,https://twitter.com/dog_rates/status/724771698126512129/photo/1,https://twitter.com/dog_rates/status/724771698126512129/photo/1",11.0,10,,doggo,604.0,2251.0,8960373.0
724405726123311104,2016-04-25 01:12:38+00:00,"<a href=""http://twitter.com/download/iphone"" rel=""nofollow"">Twitter for iPhone</a>",This is Ashleigh. She's having Coachella withdrawals. Didn't even go tho. 10/10 stay strong pupper https://t.co/nRUaKWnJfH,https://twitter.com/dog_rates/status/724405726123311104/photo/1,10.0,10,Ashleigh,pupper,1591.0,5087.0,8960373.0
724049859469295616,2016-04-24 01:38:33+00:00,"<a href=""http://twitter.com/download/iphone"" rel=""nofollow"">Twitter for iPhone</a>",This is Kreggory. He just took a look at his student debt. 10/10 can't even comprehend it https://t.co/XTsZTgilnT,https://twitter.com/dog_rates/status/724049859469295616/photo/1,10.0,10,Kreggory,,1699.0,4177.0,8960373.0
724046343203856385,2016-04-24 01:24:35+00:00,"<a href=""http://twitter.com/download/iphone"" rel=""nofollow"">Twitter for iPhone</a>","This is Sarge. Not even he knows what his tongue is doing, but it's pretty damn spectacular. 10/10 https://t.co/pIQEdbBxdL",https://twitter.com/dog_rates/status/724046343203856385/photo/1,10.0,10,Sarge,,532.0,2561.0,8960373.0
724004602748780546,2016-04-23 22:38:43+00:00,"<a href=""http://twitter.com/download/iphone"" rel=""nofollow"">Twitter for iPhone</a>",This is Luther. He saw a ghost. Spooked af. 11/10 hang in there pupper https://t.co/EdKG43VvEl,"https://twitter.com/dog_rates/status/724004602748780546/photo/1,https://twitter.com/dog_rates/status/724004602748780546/photo/1,https://twitter.com/dog_rates/status/724004602748780546/photo/1",11.0,10,Luther,pupper,1471.0,4026.0,8960373.0
723912936180330496,2016-04-23 16:34:28+00:00,"<a href=""http://twitter.com/download/iphone"" rel=""nofollow"">Twitter for iPhone</a>",This is Sugar. She's a Bolivian Superfloof. Spherical af. 12/10 would never let go of https://t.co/AhMfUu6Onm,https://twitter.com/dog_rates/status/723912936180330496/photo/1,12.0,10,Sugar,,1176.0,3742.0,8960373.0
723688335806480385,2016-04-23 01:41:59+00:00,"<a href=""http://twitter.com/download/iphone"" rel=""nofollow"">Twitter for iPhone</a>",This is Reginald. He starts screaming at random. 12/10 cuddly af https://t.co/YgNuDQbv89,"https://twitter.com/dog_rates/status/723688335806480385/photo/1,https://twitter.com/dog_rates/status/723688335806480385/photo/1",12.0,10,Reginald,,2791.0,7362.0,8960373.0
723673163800948736,2016-04-23 00:41:42+00:00,"<a href=""http://twitter.com/download/iphone"" rel=""nofollow"">Twitter for iPhone</a>",This is Ivar. She is a badass Viking warrior. Will sack your village. 10/10 savage af https://t.co/Dz6MiVssVU,https://twitter.com/dog_rates/status/723673163800948736/photo/1,10.0,10,Ivar,,846.0,2919.0,8960373.0
723179728551723008,2016-04-21 16:00:57+00:00,"<a href=""http://twitter.com/download/iphone"" rel=""nofollow"">Twitter for iPhone</a>",This is Jangle. She's addicted to broccoli. It's the only thing she cares about. Tragic af. 8/10 get help pup https://t.co/8dNWp1cSEa,https://twitter.com/dog_rates/status/723179728551723008/photo/1,8.0,10,Jangle,,1781.0,5092.0,8960373.0
722974582966214656,2016-04-21 02:25:47+00:00,"<a href=""http://twitter.com/download/iphone"" rel=""nofollow"">Twitter for iPhone</a>",Happy 4/20 from the squad! 13/10 for all https://t.co/eV1diwds8a,https://twitter.com/dog_rates/status/722974582966214656/photo/1,4.0,10,,,1497.0,3948.0,8960373.0
722613351520608256,2016-04-20 02:30:23+00:00,"<a href=""http://twitter.com/download/iphone"" rel=""nofollow"">Twitter for iPhone</a>",Meet Schnitzel. He's a Tropicana Floofboop. Getting too big for his favorite basket. 12/10 just so damn fluffy https://t.co/qjd0UJKYUY,https://twitter.com/dog_rates/status/722613351520608256/photo/1,12.0,10,Schnitzel,,1561.0,4795.0,8960373.0
721503162398597120,2016-04-17 00:58:53+00:00,"<a href=""http://twitter.com/download/iphone"" rel=""nofollow"">Twitter for iPhone</a>",This is Panda. He's happy af. 11/10 https://t.co/IOAk9i4UvE,"https://twitter.com/dog_rates/status/721503162398597120/photo/1,https://twitter.com/dog_rates/status/721503162398597120/photo/1,https://twitter.com/dog_rates/status/721503162398597120/photo/1,https://twitter.com/dog_rates/status/721503162398597120/photo/1",11.0,10,Panda,,1744.0,4438.0,8960373.0
721001180231503872,2016-04-15 15:44:11+00:00,"<a href=""http://twitter.com/download/iphone"" rel=""nofollow"">Twitter for iPhone</a>",This is Oliver. Bath time is upon him. His fear of the wetness postpones his ultimate pupper destiny. 11/10 https://t.co/AFzzKqR4tT,https://twitter.com/dog_rates/status/721001180231503872/photo/1,11.0,10,Oliver,pupper,586.0,2431.0,8960373.0
720785406564900865,2016-04-15 01:26:47+00:00,"<a href=""http://twitter.com/download/iphone"" rel=""nofollow"">Twitter for iPhone</a>",This is Archie. He hears everything you say. Doesn't matter where you are. 12/10 https://t.co/0l4I8famYp,https://twitter.com/dog_rates/status/720785406564900865/photo/1,12.0,10,Archie,,731.0,2985.0,8960373.0
720775346191278080,2016-04-15 00:46:48+00:00,"<a href=""http://twitter.com/download/iphone"" rel=""nofollow"">Twitter for iPhone</a>",This is Berkeley. He's in a predicament. 10/10 someone help him https://t.co/XSEXdQupej,https://twitter.com/dog_rates/status/720775346191278080/photo/1,10.0,10,Berkeley,,630.0,2364.0,8960373.0
720415127506415616,2016-04-14 00:55:25+00:00,"<a href=""http://twitter.com/download/iphone"" rel=""nofollow"">Twitter for iPhone</a>",Garden's coming in nice this year. 10/10 https://t.co/5Lra3e4rrw,"https://twitter.com/dog_rates/status/720415127506415616/photo/1,https://twitter.com/dog_rates/status/720415127506415616/photo/1,https://twitter.com/dog_rates/status/720415127506415616/photo/1",10.0,10,,,1435.0,3977.0,8960373.0
720389942216527872,2016-04-13 23:15:21+00:00,"<a href=""http://twitter.com/download/iphone"" rel=""nofollow"">Twitter for iPhone</a>",This is RalphÃ©. He patrols the lake. Looking for babes. 11/10 https://t.co/Pb6iMmo0wk,https://twitter.com/dog_rates/status/720389942216527872/photo/1,11.0,10,RalphÃ©,,2389.0,6116.0,8960373.0
720340705894408192,2016-04-13 19:59:42+00:00,"<a href=""http://twitter.com/download/iphone"" rel=""nofollow"">Twitter for iPhone</a>",This is Derek. He just got balled on. Can't even get up. Poor thing. 10/10 hang in there pupper https://t.co/BIRRF3bcWH,https://twitter.com/dog_rates/status/720340705894408192/photo/1,10.0,10,Derek,pupper,934.0,2756.0,8960373.0
720059472081784833,2016-04-13 01:22:10+00:00,"<a href=""http://twitter.com/download/iphone"" rel=""nofollow"">Twitter for iPhone</a>",This is Charleson. He lost his plunger. Looked everywhere. Can't find it. So sad. 9/10 would comfort https://t.co/pRHX8yn9Yu,https://twitter.com/dog_rates/status/720059472081784833/photo/1,9.0,10,Charleson,,1071.0,3713.0,8960373.0
720043174954147842,2016-04-13 00:17:25+00:00,"<a href=""http://twitter.com/download/iphone"" rel=""nofollow"">Twitter for iPhone</a>",This is Neptune. He's a Snowy Swiss Mountain Floofapolis. Cheeky wink. Tongue nifty af. 11/10 would pet so firmly https://t.co/SoZq2Xoopv,https://twitter.com/dog_rates/status/720043174954147842/photo/1,11.0,10,Neptune,,1919.0,4739.0,8960373.0
719991154352222208,2016-04-12 20:50:42+00:00,"<a href=""http://twitter.com/download/iphone"" rel=""nofollow"">Twitter for iPhone</a>",This doggo was initially thrilled when she saw the happy cartoon pup but quickly realized she'd been deceived. 10/10 https://t.co/mvnBGaWULV,"https://twitter.com/dog_rates/status/719991154352222208/photo/1,https://twitter.com/dog_rates/status/719991154352222208/photo/1",10.0,10,,doggo,1665.0,4654.0,8960373.0
719704490224398336,2016-04-12 01:51:36+00:00,"<a href=""http://twitter.com/download/iphone"" rel=""nofollow"">Twitter for iPhone</a>",This is Clyde. He's making sure you're having a good train ride. 12/10 great pupper https://t.co/y206kWHAj0,https://twitter.com/dog_rates/status/719704490224398336/photo/1,12.0,10,Clyde,pupper,1362.0,4362.0,8960373.0
719551379208073216,2016-04-11 15:43:12+00:00,"<a href=""http://twitter.com/download/iphone"" rel=""nofollow"">Twitter for iPhone</a>",This is Harnold. He accidentally opened the front facing camera. 10/10 get it together Harnold https://t.co/S6JHaSMtln,https://twitter.com/dog_rates/status/719551379208073216/photo/1,10.0,10,Harnold,,1806.0,4862.0,8960373.0
719367763014393856,2016-04-11 03:33:34+00:00,"<a href=""http://twitter.com/download/iphone"" rel=""nofollow"">Twitter for iPhone</a>",Meet Sid &amp; Murphy. Murphy floats alongside Sid and whispers motivational quotes in his ear. Magical af. Both 11/10 https://t.co/7mmjyearQW,https://twitter.com/dog_rates/status/719367763014393856/photo/1,11.0,10,Sid,,712.0,2689.0,8960373.0
719339463458033665,2016-04-11 01:41:07+00:00,"<a href=""http://twitter.com/download/iphone"" rel=""nofollow"">Twitter for iPhone</a>",Say hello to Lucy and Sophie. They think they're the same size. Both 10/10 would snug at same time https://t.co/HW50zkcf2R,https://twitter.com/dog_rates/status/719339463458033665/photo/1,10.0,10,Lucy,,1179.0,4278.0,8960373.0
719332531645071360,2016-04-11 01:13:34+00:00,"<a href=""http://twitter.com/download/iphone"" rel=""nofollow"">Twitter for iPhone</a>",This is Pippa. She managed to start the car but is waiting for you to buckle up before driving. Responsible af 11/10 https://t.co/htrlmC7saz,https://twitter.com/dog_rates/status/719332531645071360/photo/1,11.0,10,Pippa,,905.0,3302.0,8960373.0
718971898235854848,2016-04-10 01:20:33+00:00,"<a href=""http://twitter.com/download/iphone"" rel=""nofollow"">Twitter for iPhone</a>",This is Sadie. She is prepared for battle. 10/10 https://t.co/JRckDkZVRT,https://twitter.com/dog_rates/status/718971898235854848/photo/1,10.0,10,Sadie,,1030.0,3343.0,8960373.0
718939241951195136,2016-04-09 23:10:47+00:00,"<a href=""http://twitter.com/download/iphone"" rel=""nofollow"">Twitter for iPhone</a>",This is Otis. Everybody look at Otis. 12/10 would probably faint while petting https://t.co/I9qoe1uEih,https://twitter.com/dog_rates/status/718939241951195136/photo/1,12.0,10,Otis,,1669.0,5052.0,8960373.0
718631497683582976,2016-04-09 02:47:55+00:00,"<a href=""http://twitter.com/download/iphone"" rel=""nofollow"">Twitter for iPhone</a>",We normally don't rate marshmallows but this one appears to be flawlessly toasted so I'll make an exception. 10/10 https://t.co/D9jbbmPmos,https://twitter.com/dog_rates/status/718631497683582976/photo/1,10.0,10,,,7646.0,18126.0,8960373.0
718613305783398402,2016-04-09 01:35:37+00:00,"<a href=""http://twitter.com/download/iphone"" rel=""nofollow"">Twitter for iPhone</a>",This is Carper. He's a Tortellini Angiosperm. In desperate need of a petting. 11/10 would hug softly https://t.co/lK9YDkRzPj,https://twitter.com/dog_rates/status/718613305783398402/photo/1,11.0,10,Carper,,456.0,2345.0,8960373.0
718540630683709445,2016-04-08 20:46:50+00:00,"<a href=""http://twitter.com/download/iphone"" rel=""nofollow"">Twitter for iPhone</a>",Get you a pup that can do both. 10/10 https://t.co/zSbyvm62xZ,"https://twitter.com/dog_rates/status/718540630683709445/photo/1,https://twitter.com/dog_rates/status/718540630683709445/photo/1",10.0,10,,,966.0,2348.0,8960373.0
718460005985447936,2016-04-08 15:26:28+00:00,"<a href=""http://twitter.com/download/iphone"" rel=""nofollow"">Twitter for iPhone</a>",Meet Bowie. He's listening for underground squirrels. Smart af. Left eye is considerably magical. 9/10 would so pet https://t.co/JyNmyjy3fe,https://twitter.com/dog_rates/status/718460005985447936/photo/1,9.0,10,Bowie,,500.0,2588.0,8960373.0
718454725339934721,2016-04-08 15:05:29+00:00,"<a href=""http://twitter.com/download/iphone"" rel=""nofollow"">Twitter for iPhone</a>","This pic is old but I hadn't seen it until today and had to share. Creative af. 13/10 very good boy, would pet well https://t.co/4kD16wMA1Z",https://twitter.com/dog_rates/status/718454725339934721/photo/1,13.0,10,,,1441.0,4665.0,8960373.0
718246886998687744,2016-04-08 01:19:36+00:00,"<a href=""http://twitter.com/download/iphone"" rel=""nofollow"">Twitter for iPhone</a>",This is Alexanderson. He's got a weird ass birth mark. Dreadful at fetch. Won't eat kibble. 3/10 wtf @Target https://t.co/FmxOpf2Sgl,https://twitter.com/dog_rates/status/718246886998687744/photo/1,3.0,10,Alexanderson,,474.0,1840.0,8960373.0
718234618122661888,2016-04-08 00:30:51+00:00,"<a href=""http://twitter.com/download/iphone"" rel=""nofollow"">Twitter for iPhone</a>",This is Suki. She was born with a blurry tail (unfortunate). Next level tongue tho. 11/10 nifty hardwood https://t.co/05S8oYztgb,https://twitter.com/dog_rates/status/718234618122661888/photo/1,11.0,10,Suki,,947.0,3714.0,8960373.0
717841801130979328,2016-04-06 22:29:56+00:00,"<a href=""http://twitter.com/download/iphone"" rel=""nofollow"">Twitter for iPhone</a>",This is Barclay. His father was a banana. 11/10 appeeling af https://t.co/ucOEfr2rjV,https://twitter.com/dog_rates/status/717841801130979328/photo/1,11.0,10,Barclay,,570.0,2356.0,8960373.0
717790033953034240,2016-04-06 19:04:14+00:00,"<a href=""http://twitter.com/download/iphone"" rel=""nofollow"">Twitter for iPhone</a>","Here's a badass mystery pupper. You weren't aware that you owe him money, but you do. 10/10 shades sick af https://t.co/fv9e9AtzSG",https://twitter.com/dog_rates/status/717790033953034240/photo/1,10.0,10,,pupper,1047.0,2752.0,8960373.0
717537687239008257,2016-04-06 02:21:30+00:00,"<a href=""http://twitter.com/download/iphone"" rel=""nofollow"">Twitter for iPhone</a>",People please. This is a Deadly Mediterranean Plop T-Rex. We only rate dogs. Only send in dogs. Thanks you... 11/10 https://t.co/2ATDsgHD4n,https://twitter.com/dog_rates/status/717537687239008257/photo/1,11.0,10,,,1760.0,5572.0,8960373.0
717421804990701568,2016-04-05 18:41:02+00:00,"<a href=""http://twitter.com/download/iphone"" rel=""nofollow"">Twitter for iPhone</a>",This is Ebby. She's a Zimbabwean Feta. Embarrassed by ridiculously squishy face. 9/10 would squeeze softly https://t.co/LBJqxMGaHi,"https://twitter.com/dog_rates/status/717421804990701568/photo/1,https://twitter.com/dog_rates/status/717421804990701568/photo/1",9.0,10,Ebby,,800.0,3041.0,8960373.0
717047459982213120,2016-04-04 17:53:31+00:00,"<a href=""http://twitter.com/download/iphone"" rel=""nofollow"">Twitter for iPhone</a>",This is FlÃ¡vio (pronounced Baxter). He's a Benesnoop Cumberdog. Super rare. Symmetrical. 12/10 would pet so well https://t.co/fGgleFiBPq,https://twitter.com/dog_rates/status/717047459982213120/photo/1,12.0,10,FlÃ¡vio,,1833.0,6040.0,8960373.0
717009362452090881,2016-04-04 15:22:08+00:00,"<a href=""http://twitter.com/download/iphone"" rel=""nofollow"">Twitter for iPhone</a>",This is Smokey. He's having some sort of existential crisis. 10/10 hang in there pupper https://t.co/JmgF4dMpw0,https://twitter.com/dog_rates/status/717009362452090881/photo/1,10.0,10,Smokey,pupper,920.0,3114.0,8960373.0
716802964044845056,2016-04-04 01:41:58+00:00,"<a href=""http://twitter.com/download/iphone"" rel=""nofollow"">Twitter for iPhone</a>",This is Link. He struggles with couches. 10/10 would assist https://t.co/SbX4e6Yg3o,"https://twitter.com/dog_rates/status/716802964044845056/photo/1,https://twitter.com/dog_rates/status/716802964044845056/photo/1",10.0,10,Link,,1117.0,4128.0,8960373.0
716791146589110272,2016-04-04 00:55:01+00:00,"<a href=""http://twitter.com/download/iphone"" rel=""nofollow"">Twitter for iPhone</a>",Meet Jennifur. She's supposed to be navigating. Not even buckled up. Insubordinate &amp; churlish. 11/10 would still pet https://t.co/h0trcJohYO,https://twitter.com/dog_rates/status/716791146589110272/photo/1,11.0,10,Jennifur,,1512.0,7914.0,8960373.0
716439118184652801,2016-04-03 01:36:11+00:00,"<a href=""http://twitter.com/download/iphone"" rel=""nofollow"">Twitter for iPhone</a>",This is Bluebert. He just saw that both #FinalFur match ups are split 50/50. Amazed af. 11/10 https://t.co/Kky1DPG4iq,https://twitter.com/dog_rates/status/716439118184652801/photo/1,50.0,10,Bluebert,,201.0,2296.0,8960372.0
716285507865542656,2016-04-02 15:25:47+00:00,"<a href=""http://twitter.com/download/iphone"" rel=""nofollow"">Twitter for iPhone</a>",This is Stephanus. She stays woke. 12/10 https://t.co/WIWabMngQZ,"https://twitter.com/dog_rates/status/716285507865542656/photo/1,https://twitter.com/dog_rates/status/716285507865542656/photo/1",12.0,10,Stephanus,,1006.0,2668.0,8960372.0
716080869887381504,2016-04-02 01:52:38+00:00,"<a href=""http://twitter.com/download/iphone"" rel=""nofollow"">Twitter for iPhone</a>",Here's a super majestic doggo and a sunset 11/10 https://t.co/UACnoyi8zu,"https://twitter.com/dog_rates/status/716080869887381504/photo/1,https://twitter.com/dog_rates/status/716080869887381504/photo/1",11.0,10,,doggo,1820.0,6520.0,8960372.0
715928423106027520,2016-04-01 15:46:52+00:00,"<a href=""http://twitter.com/download/iphone"" rel=""nofollow"">Twitter for iPhone</a>",This is Bubbles. He's a Yorkshire Piccolope. 11/10 would snug aggressively https://t.co/3BhMojONxq,https://twitter.com/dog_rates/status/715928423106027520/photo/1,11.0,10,Bubbles,,843.0,3072.0,8960372.0
715733265223708672,2016-04-01 02:51:22+00:00,"<a href=""http://twitter.com/download/iphone"" rel=""nofollow"">Twitter for iPhone</a>",This is a taco. We only rate dogs. Please only send in dogs. Dogs are what we rate. Not tacos. Thank you... 10/10 https://t.co/cxl6xGY8B9,https://twitter.com/dog_rates/status/715733265223708672/photo/1,10.0,10,,,1615.0,4495.0,8960372.0
715696743237730304,2016-04-01 00:26:15+00:00,"<a href=""http://twitter.com/download/iphone"" rel=""nofollow"">Twitter for iPhone</a>",Meet Toby. He's a Lithuanian High-Steppin Stickeroo. One of the more accomplished Stickeroos around. 10/10 so nifty https://t.co/cYPHuJYTjC,https://twitter.com/dog_rates/status/715696743237730304/photo/1,10.0,10,Toby,,1234.0,3764.0,8960372.0
715680795826982913,2016-03-31 23:22:53+00:00,"<a href=""http://twitter.com/download/iphone"" rel=""nofollow"">Twitter for iPhone</a>",This is Zeus. He's downright fabulous. 12/10 https://t.co/sSugyyRuTp,"https://twitter.com/dog_rates/status/715680795826982913/photo/1,https://twitter.com/dog_rates/status/715680795826982913/photo/1,https://twitter.com/dog_rates/status/715680795826982913/photo/1",12.0,10,Zeus,,1532.0,4128.0,8960372.0
715360349751484417,2016-03-31 02:09:32+00:00,"<a href=""http://twitter.com/download/iphone"" rel=""nofollow"">Twitter for iPhone</a>",This is Bertson. He just wants to say hi. 11/10 would boop nose https://t.co/hwv7Wq6gDA,https://twitter.com/dog_rates/status/715360349751484417/photo/1,11.0,10,Bertson,,1495.0,5265.0,8960372.0
715342466308784130,2016-03-31 00:58:29+00:00,"<a href=""http://twitter.com/download/iphone"" rel=""nofollow"">Twitter for iPhone</a>",This is Oscar. He's a world renowned snowball inspector. It's a ruff job but someone has to do it. 10/10 great guy https://t.co/vSufMAKm3C,"https://twitter.com/dog_rates/status/715342466308784130/photo/1,https://twitter.com/dog_rates/status/715342466308784130/photo/1",10.0,10,Oscar,,656.0,2935.0,8960372.0
715220193576927233,2016-03-30 16:52:36+00:00,"<a href=""http://twitter.com/download/iphone"" rel=""nofollow"">Twitter for iPhone</a>",This is Nico. His selfie game is strong af. Excellent use of a sneaky tongue slip. 10/10 star material https://t.co/1OBdJkMOFx,https://twitter.com/dog_rates/status/715220193576927233/photo/1,10.0,10,Nico,,617.0,2332.0,8960372.0
715200624753819648,2016-03-30 15:34:51+00:00,"<a href=""http://twitter.com/download/iphone"" rel=""nofollow"">Twitter for iPhone</a>",This is Michelangelope. He's half coffee cup. Rare af. 12/10 would hug until someone stopped me https://t.co/tvVDY0G911,https://twitter.com/dog_rates/status/715200624753819648/photo/1,12.0,10,Michelangelope,,1780.0,4956.0,8960372.0
715009755312439296,2016-03-30 02:56:24+00:00,"<a href=""http://twitter.com/download/iphone"" rel=""nofollow"">Twitter for iPhone</a>",This is Siba. She's remarkably mobile. Very sleepy as well. 12/10 would happily transport https://t.co/TjnI33RE1i,https://twitter.com/dog_rates/status/715009755312439296/photo/1,12.0,10,Siba,,1168.0,3993.0,8960372.0
714982300363173890,2016-03-30 01:07:18+00:00,"<a href=""http://twitter.com/download/iphone"" rel=""nofollow"">Twitter for iPhone</a>",This is Calbert. He forgot to clear his Google search history. 9/10 rookie mistake Calbert https://t.co/jRm5J3YCmj,https://twitter.com/dog_rates/status/714982300363173890/photo/1,9.0,10,Calbert,,990.0,3577.0,8960372.0
714957620017307648,2016-03-29 23:29:14+00:00,"<a href=""http://twitter.com/download/iphone"" rel=""nofollow"">Twitter for iPhone</a>",This is Curtis. He's an Albino Haberdasher. Terrified of dandelions. They really spook him up. 10/10 it'll be ok pup https://t.co/s8YcfZrWhK,https://twitter.com/dog_rates/status/714957620017307648/photo/1,10.0,10,Curtis,,1350.0,3996.0,8960372.0
714631576617938945,2016-03-29 01:53:39+00:00,"<a href=""http://twitter.com/download/iphone"" rel=""nofollow"">Twitter for iPhone</a>",This is Benedict. He's a feisty pup. Needs a brushing. Portable af. Looks very angry actually. 4/10 might not pet https://t.co/3oeFfHjv0Z,https://twitter.com/dog_rates/status/714631576617938945/photo/1,4.0,10,Benedict,,948.0,3150.0,8960372.0
714606013974974464,2016-03-29 00:12:05+00:00,"<a href=""http://twitter.com/download/iphone"" rel=""nofollow"">Twitter for iPhone</a>",Here are two lil cuddly puppers. Both 12/10 would snug like so much https://t.co/zO4eb7C4tG,https://twitter.com/dog_rates/status/714606013974974464/photo/1,12.0,10,,,880.0,3498.0,8960372.0
714258258790387713,2016-03-28 01:10:13+00:00,"<a href=""http://twitter.com/download/iphone"" rel=""nofollow"">Twitter for iPhone</a>","Meet Travis and Flurp. Travis is pretty chill but Flurp can't lie down properly. 10/10 &amp; 8/10
get it together Flurp https://t.co/Akzl5ynMmE",https://twitter.com/dog_rates/status/714258258790387713/photo/1,10.0,10,Travis,,699.0,2921.0,8960372.0
714251586676113411,2016-03-28 00:43:43+00:00,"<a href=""http://twitter.com/download/iphone"" rel=""nofollow"">Twitter for iPhone</a>",This is Thumas. He hates potted plants. 8/10 wtf Thumas https://t.co/rDVueNIcEi,"https://twitter.com/dog_rates/status/714251586676113411/photo/1,https://twitter.com/dog_rates/status/714251586676113411/photo/1",8.0,10,Thumas,,801.0,3151.0,8960372.0
714214115368108032,2016-03-27 22:14:49+00:00,"<a href=""http://twitter.com/download/iphone"" rel=""nofollow"">Twitter for iPhone</a>",Happy Easter from the squad! ðŸ‡ðŸ¶ 13/10 for all https://t.co/YMx4KWJUAB,https://twitter.com/dog_rates/status/714214115368108032/photo/1,13.0,10,,,831.0,2196.0,8960372.0
