tweet_id,timestamp,source,text,expanded_urls,rating_numerator,rating_denominator,name,dog_breed,retweet_count,favorite_count,user_count
892420643555336193,2017-08-01 16:23:56+00:00,"<a href=""http://twitter.com/download/iphone"" rel=""nofollow"">Twitter for iPhone</a>",This is Phineas. He's a mystical boy. Only ever appears in the hole of a donut. 13/10 https://t.co/MgUWQ76dJU,https://twitter.com/dog_rates/status/892420643555336193/photo/1,13.0,10,Phineas,,7390.0,35099.0,8960354.0
892177421306343426,2017-08-01 00:17:27+00:00,"<a href=""http://twitter.com/download/iphone"" rel=""nofollow"">Twitter for iPhone</a>","This is Tilly. She's just checking pup on you. Hopes you're doing ok. If not, she's available for pats, snugs, boops, the whole bit. 13/10 https://t.co/0Xxu71qeIV",https://twitter.com/dog_rates/status/892177421306343426/photo/1,13.0,10,Tilly,,5504.0,30383.0,8960354.0
891815181378084864,2017-07-31 00:18:03+00:00,"<a href=""http://twitter.com/download/iphone"" rel=""nofollow"">Twitter for iPhone</a>",This is Archie. He is a rare Norwegian Pouncing Corgo. Lives in the tall grass. You never know when one may strike. 12/10 https://t.co/wUnZnhtVJB,https://twitter.com/dog_rates/status/891815181378084864/photo/1,12.0,10,Archie,,3637.0,22845.0,8960354.0
891689557279858688,2017-07-30 15:58:51+00:00,"<a href=""http://twitter.com/download/iphone"" rel=""nofollow"">Twitter for iPhone</a>",This is Darla. She commenced a snooze mid meal. 13/10 happens to the best of us https://t.co/tD36da7qLQ,https://twitter.com/dog_rates/status/891689557279858688/photo/1,13.0,10,Darla,,7566.0,38374.0,8960354.0
891327558926688256,2017-07-29 16:00:24+00:00,"<a href=""http://twitter.com/download/iphone"" rel=""nofollow"">Twitter for iPhone</a>","This is Franklin. He would like you to stop calling him ""cute."" He is a very fierce shark and should be respected as such. 12/10 #BarkWeek https://t.co/AtUZn91f7f","https://twitter.com/dog_rates/status/891327558926688256/photo/1,https://twitter.com/dog_rates/status/891327558926688256/photo/1",12.0,10,Franklin,,8151.0,36645.0,8960354.0
891087950875897856,2017-07-29 00:08:17+00:00,"<a href=""http://twitter.com/download/iphone"" rel=""nofollow"">Twitter for iPhone</a>",Here we have a majestic great white breaching off South Africa's coast. Absolutely h*ckin breathtaking. 13/10 (IG: tucker_marlo) #BarkWeek https://t.co/kQ04fDDRmh,https://twitter.com/dog_rates/status/891087950875897856/photo/1,13.0,10,,,2733.0,18485.0,8960354.0
890971913173991426,2017-07-28 16:27:12+00:00,"<a href=""http://twitter.com/download/iphone"" rel=""nofollow"">Twitter for iPhone</a>","Meet Jax. He enjoys ice cream so much he gets nervous around it. 13/10 help Jax enjoy more things by clicking below

https://t.co/Zr4hWfAs1H https://t.co/tVJBRMnhxl","https://gofundme.com/ydvmve-surgery-for-jax,https://twitter.com/dog_rates/status/890971913173991426/photo/1",13.0,10,Jax,,1769.0,10745.0,8960354.0
890729181411237888,2017-07-28 00:22:40+00:00,"<a href=""http://twitter.com/download/iphone"" rel=""nofollow"">Twitter for iPhone</a>",When you watch your owner call another dog a good boy but then they turn back to you and say you're a great boy. 13/10 https://t.co/v0nONBcwxq,"https://twitter.com/dog_rates/status/890729181411237888/photo/1,https://twitter.com/dog_rates/status/890729181411237888/photo/1",13.0,10,,,16541.0,59102.0,8960354.0
890609185150312448,2017-07-27 16:25:51+00:00,"<a href=""http://twitter.com/download/iphone"" rel=""nofollow"">Twitter for iPhone</a>",This is Zoey. She doesn't want to be one of the scary sharks. Just wants to be a snuggly pettable boatpet. 13/10 #BarkWeek https://t.co/9TwLuAGH0b,https://twitter.com/dog_rates/status/890609185150312448/photo/1,13.0,10,Zoey,,3786.0,25427.0,8960354.0
890240255349198849,2017-07-26 15:59:51+00:00,"<a href=""http://twitter.com/download/iphone"" rel=""nofollow"">Twitter for iPhone</a>",This is Cassie. She is a college pup. Studying international doggo communication and stick theory. 14/10 so elegant much sophisticate https://t.co/t1bfwz5S2A,https://twitter.com/dog_rates/status/890240255349198849/photo/1,14.0,10,Cassie,doggo,6414.0,29019.0,8960354.0
890006608113172480,2017-07-26 00:31:25+00:00,"<a href=""http://twitter.com/download/iphone"" rel=""nofollow"">Twitter for iPhone</a>",This is Koda. He is a South Australian deckshark. Deceptively deadly. Frighteningly majestic. 13/10 would risk a petting #BarkWeek https://t.co/dVPW0B0Mme,"https://twitter.com/dog_rates/status/890006608113172480/photo/1,https://twitter.com/dog_rates/status/890006608113172480/photo/1",13.0,10,Koda,,6434.0,28003.0,8960354.0
889880896479866881,2017-07-25 16:11:53+00:00,"<a href=""http://twitter.com/download/iphone"" rel=""nofollow"">Twitter for iPhone</a>",This is Bruno. He is a service shark. Only gets out of the water to assist you. 13/10 terrifyingly good boy https://t.co/u1XPQMl29g,https://twitter.com/dog_rates/status/889880896479866881/photo/1,13.0,10,Bruno,,4368.0,25448.0,8960354.0
889665388333682689,2017-07-25 01:55:32+00:00,"<a href=""http://twitter.com/download/iphone"" rel=""nofollow"">Twitter for iPhone</a>",Here's a puppo that seems to be on the fence about something haha no but seriously someone help her. 13/10 https://t.co/BxvuXk0UCm,https://twitter.com/dog_rates/status/889665388333682689/photo/1,13.0,10,,puppo,8774.0,43718.0,8960354.0
889638837579907072,2017-07-25 00:10:02+00:00,"<a href=""http://twitter.com/download/iphone"" rel=""nofollow"">Twitter for iPhone</a>",This is Ted. He does his best. Sometimes that's not enough. But it's ok. 12/10 would assist https://t.co/f8dEDcrKSR,"https://twitter.com/dog_rates/status/889638837579907072/photo/1,https://twitter.com/dog_rates/status/889638837579907072/photo/1",12.0,10,Ted,,3920.0,24565.0,8960354.0
889531135344209921,2017-07-24 17:02:04+00:00,"<a href=""http://twitter.com/download/iphone"" rel=""nofollow"">Twitter for iPhone</a>",This is Stuart. He's sporting his favorite fanny pack. Secretly filled with bones only. 13/10 puppared puppo #BarkWeek https://t.co/y70o6h3isq,https://twitter.com/dog_rates/status/889531135344209921/photo/1,13.0,10,Stuart,puppo,1979.0,13844.0,8960354.0
889278841981685760,2017-07-24 00:19:32+00:00,"<a href=""http://twitter.com/download/iphone"" rel=""nofollow"">Twitter for iPhone</a>",This is Oliver. You're witnessing one of his many brutal attacks. Seems to be playing with his victim. 13/10 fr*ckin frightening #BarkWeek https://t.co/WpHvrQedPb,https://twitter.com/dog_rates/status/889278841981685760/video/1,13.0,10,Oliver,,4661.0,22924.0,8960354.0
888917238123831296,2017-07-23 00:22:39+00:00,"<a href=""http://twitter.com/download/iphone"" rel=""nofollow"">Twitter for iPhone</a>",This is Jim. He found a fren. Taught him how to sit like the good boys. 12/10 for both https://t.co/chxruIOUJN,https://twitter.com/dog_rates/status/888917238123831296/photo/1,12.0,10,Jim,,3930.0,26551.0,8960354.0
888804989199671297,2017-07-22 16:56:37+00:00,"<a href=""http://twitter.com/download/iphone"" rel=""nofollow"">Twitter for iPhone</a>",This is Zeke. He has a new stick. Very proud of it. Would like you to throw it for him without taking it. 13/10 would do my best https://t.co/HTQ77yNQ5K,"https://twitter.com/dog_rates/status/888804989199671297/photo/1,https://twitter.com/dog_rates/status/888804989199671297/photo/1",13.0,10,Zeke,,3719.0,23298.0,8960354.0
888554962724278272,2017-07-22 00:23:06+00:00,"<a href=""http://twitter.com/download/iphone"" rel=""nofollow"">Twitter for iPhone</a>",This is Ralphus. He's powering up. Attempting maximum borkdrive. 13/10 inspirational af https://t.co/YnYAFCTTiK,"https://twitter.com/dog_rates/status/888554962724278272/photo/1,https://twitter.com/dog_rates/status/888554962724278272/photo/1,https://twitter.com/dog_rates/status/888554962724278272/photo/1,https://twitter.com/dog_rates/status/888554962724278272/photo/1",13.0,10,Ralphus,,3029.0,17965.0,8960354.0
888078434458587136,2017-07-20 16:49:33+00:00,"<a href=""http://twitter.com/download/iphone"" rel=""nofollow"">Twitter for iPhone</a>",This is Gerald. He was just told he didn't get the job he interviewed for. A h*ckin injustice. 12/10 didn't want the job anyway https://t.co/DK7iDPfuRX,"https://twitter.com/dog_rates/status/888078434458587136/photo/1,https://twitter.com/dog_rates/status/888078434458587136/photo/1",12.0,10,Gerald,,3045.0,19866.0,8960354.0
887705289381826560,2017-07-19 16:06:48+00:00,"<a href=""http://twitter.com/download/iphone"" rel=""nofollow"">Twitter for iPhone</a>",This is Jeffrey. He has a monopoly on the pool noodles. Currently running a 'boop for two' midweek sale. 13/10 h*ckin strategic https://t.co/PhrUk20Q64,https://twitter.com/dog_rates/status/887705289381826560/photo/1,13.0,10,Jeffrey,,4730.0,27604.0,8960354.0
887517139158093824,2017-07-19 03:39:09+00:00,"<a href=""http://twitter.com/download/iphone"" rel=""nofollow"">Twitter for iPhone</a>",I've yet to rate a Venezuelan Hover Wiener. This is such an honor. 14/10 paw-inspiring af (IG: roxy.thedoxy) https://t.co/20VrLAA8ba,https://twitter.com/dog_rates/status/887517139158093824/video/1,14.0,10,such,,10313.0,42240.0,8960354.0
887473957103951883,2017-07-19 00:47:34+00:00,"<a href=""http://twitter.com/download/iphone"" rel=""nofollow"">Twitter for iPhone</a>",This is Canela. She attempted some fancy porch pics. They were unsuccessful. 13/10 someone help her https://t.co/cLyzpcUcMX,"https://twitter.com/dog_rates/status/887473957103951883/photo/1,https://twitter.com/dog_rates/status/887473957103951883/photo/1",13.0,10,Canela,,15753.0,62523.0,8960354.0
887343217045368832,2017-07-18 16:08:03+00:00,"<a href=""http://twitter.com/download/iphone"" rel=""nofollow"">Twitter for iPhone</a>",You may not have known you needed to see this today. 13/10 please enjoy (IG: emmylouroo) https://t.co/WZqNqygEyV,https://twitter.com/dog_rates/status/887343217045368832/video/1,13.0,10,,,9242.0,30663.0,8960354.0
887101392804085760,2017-07-18 00:07:08+00:00,"<a href=""http://twitter.com/download/iphone"" rel=""nofollow"">Twitter for iPhone</a>",This... is a Jubilant Antarctic House Bear. We only rate dogs. Please only send dogs. Thank you... 12/10 would suffocate in floof https://t.co/4Ad1jzJSdp,https://twitter.com/dog_rates/status/887101392804085760/photo/1,12.0,10,,,5229.0,27956.0,8960354.0
886983233522544640,2017-07-17 16:17:36+00:00,"<a href=""http://twitter.com/download/iphone"" rel=""nofollow"">Twitter for iPhone</a>",This is Maya. She's very shy. Rarely leaves her cup. 13/10 would find her an environment to thrive in https://t.co/I6oNy0CgiT,"https://twitter.com/dog_rates/status/886983233522544640/photo/1,https://twitter.com/dog_rates/status/886983233522544640/photo/1",13.0,10,Maya,,6696.0,31654.0,8960833.0
886736880519319552,2017-07-16 23:58:41+00:00,"<a href=""http://twitter.com/download/iphone"" rel=""nofollow"">Twitter for iPhone</a>","This is Mingus. He's a wonderful father to his smol pup. Confirmed 13/10, but he needs your help

https://t.co/bVi0Yr4Cff https://t.co/ISvKOSkd5b","https://www.gofundme.com/mingusneedsus,https://twitter.com/dog_rates/status/886736880519319552/photo/1,https://twitter.com/dog_rates/status/886736880519319552/photo/1",13.0,10,Mingus,,2784.0,10883.0,8960354.0
886680336477933568,2017-07-16 20:14:00+00:00,"<a href=""http://twitter.com/download/iphone"" rel=""nofollow"">Twitter for iPhone</a>",This is Derek. He's late for a dog meeting. 13/10 pet...al to the metal https://t.co/BCoWue0abA,https://twitter.com/dog_rates/status/886680336477933568/photo/1,13.0,10,Derek,,3927.0,20498.0,8960354.0
886366144734445568,2017-07-15 23:25:31+00:00,"<a href=""http://twitter.com/download/iphone"" rel=""nofollow"">Twitter for iPhone</a>",This is Roscoe. Another pupper fallen victim to spontaneous tongue ejections. Get the BlepiPen immediate. 12/10 deep breaths Roscoe https://t.co/RGE08MIJox,"https://twitter.com/dog_rates/status/886366144734445568/photo/1,https://twitter.com/dog_rates/status/886366144734445568/photo/1",12.0,10,Roscoe,pupper,2775.0,19237.0,8960354.0
886258384151887873,2017-07-15 16:17:19+00:00,"<a href=""http://twitter.com/download/iphone"" rel=""nofollow"">Twitter for iPhone</a>",This is Waffles. His doggles are pupside down. Unsure how to fix. 13/10 someone assist Waffles https://t.co/xZDA9Qsq1O,https://twitter.com/dog_rates/status/886258384151887873/photo/1,13.0,10,Waffles,,5542.0,25499.0,8960354.0
885984800019947520,2017-07-14 22:10:11+00:00,"<a href=""http://twitter.com/download/iphone"" rel=""nofollow"">Twitter for iPhone</a>",Viewer discretion advised. This is Jimbo. He will rip ur finger right h*ckin off. Other dog clearly an accessory. 12/10 pls pet with caution https://t.co/BuveP0uMF1,https://twitter.com/dog_rates/status/885984800019947520/photo/1,12.0,10,Jimbo,,5887.0,29683.0,8960354.0
885528943205470208,2017-07-13 15:58:47+00:00,"<a href=""http://twitter.com/download/iphone"" rel=""nofollow"">Twitter for iPhone</a>",This is Maisey. She fell asleep mid-excavation. Happens to the best of us. 13/10 would pat noggin approvingly https://t.co/tp1kQ8i9JF,https://twitter.com/dog_rates/status/885528943205470208/photo/1,13.0,10,Maisey,,5603.0,32758.0,8960355.0
885167619883638784,2017-07-12 16:03:00+00:00,"<a href=""http://twitter.com/download/iphone"" rel=""nofollow"">Twitter for iPhone</a>",Here we have a corgi undercover as a malamute. Pawbably doing important investigative work. Zero control over tongue happenings. 13/10 https://t.co/44ItaMubBf,"https://twitter.com/dog_rates/status/885167619883638784/photo/1,https://twitter.com/dog_rates/status/885167619883638784/photo/1,https://twitter.com/dog_rates/status/885167619883638784/photo/1,https://twitter.com/dog_rates/status/885167619883638784/photo/1",13.0,10,,,3838.0,19944.0,8960355.0
884925521741709313,2017-07-12 00:01:00+00:00,"<a href=""http://twitter.com/download/iphone"" rel=""nofollow"">Twitter for iPhone</a>","This is Earl. He found a hat. Nervous about what you think of it. 12/10 it's delightful, Earl https://t.co/MYJvdlNRVa",https://twitter.com/dog_rates/status/884925521741709313/photo/1,12.0,10,Earl,,15828.0,70042.0,8960355.0
884876753390489601,2017-07-11 20:47:12+00:00,"<a href=""http://twitter.com/download/iphone"" rel=""nofollow"">Twitter for iPhone</a>",This is Lola. It's her first time outside. Must test the earth and taste the atmosphere. 13/10 you're doing great Lola https://t.co/74TKAUsLkO,"https://twitter.com/dog_rates/status/884876753390489601/photo/1,https://twitter.com/dog_rates/status/884876753390489601/photo/1,https://twitter.com/dog_rates/status/884876753390489601/photo/1,https://twitter.com/dog_rates/status/884876753390489601/photo/1",13.0,10,Lola,,4902.0,25347.0,8960355.0
884562892145688576,2017-07-11 00:00:02+00:00,"<a href=""http://twitter.com/download/iphone"" rel=""nofollow"">Twitter for iPhone</a>",This is Kevin. He's just so happy. 13/10 what is your secret Kevin https://t.co/1r4MFCbCX5,https://twitter.com/dog_rates/status/884562892145688576/photo/1,13.0,10,Kevin,,4122.0,22140.0,8960355.0
884441805382717440,2017-07-10 15:58:53+00:00,"<a href=""http://twitter.com/download/iphone"" rel=""nofollow"">Twitter for iPhone</a>","I present to you, Pup in Hat. Pup in Hat is great for all occasions. Extremely versatile. Compact as h*ck. 14/10 (IG: itselizabethgales) https://t.co/vvBOcC2VdC",https://twitter.com/dog_rates/status/884441805382717440/photo/1,14.0,10,,,4995.0,24729.0,8960355.0
884162670584377345,2017-07-09 21:29:42+00:00,"<a href=""http://twitter.com/download/iphone"" rel=""nofollow"">Twitter for iPhone</a>",Meet Yogi. He doesn't have any important dog meetings today he just enjoys looking his best at all times. 12/10 for dangerously dapper doggo https://t.co/YSI00BzTBZ,https://twitter.com/dog_rates/status/884162670584377345/photo/1,12.0,10,Yogi,doggo,2625.0,18593.0,8960355.0
883838122936631299,2017-07-09 00:00:04+00:00,"<a href=""http://twitter.com/download/iphone"" rel=""nofollow"">Twitter for iPhone</a>",This is Noah. He can't believe someone made this mess. Got the vacuum out for you though. Offered to help clean pup. 12/10 super good boy https://t.co/V85xujjDDY,https://twitter.com/dog_rates/status/883838122936631299/photo/1,12.0,10,Noah,,2995.0,19908.0,8960355.0
883482846933004288,2017-07-08 00:28:19+00:00,"<a href=""http://twitter.com/download/iphone"" rel=""nofollow"">Twitter for iPhone</a>","This is Bella. She hopes her smile made you smile. If not, she is also offering you her favorite monkey. 13.5/10 https://t.co/qjrljjt948","https://twitter.com/dog_rates/status/883482846933004288/photo/1,https://twitter.com/dog_rates/status/883482846933004288/photo/1",13.5,10,Bella,,8660.0,41732.0,8960355.0
883360690899218434,2017-07-07 16:22:55+00:00,"<a href=""http://twitter.com/download/iphone"" rel=""nofollow"">Twitter for iPhone</a>",Meet Grizzwald. He may be the floofiest floofer I ever did see. Lost eyes saving a schoolbus from a volcano erpuption. 13/10 heroic as h*ck https://t.co/rf661IFEYP,https://twitter.com/dog_rates/status/883360690899218434/photo/1,13.0,10,Grizzwald,floofer,3226.0,20668.0,8960355.0
883117836046086144,2017-07-07 00:17:54+00:00,"<a href=""http://twitter.com/download/iphone"" rel=""nofollow"">Twitter for iPhone</a>","Please only send dogs. We don't rate mechanics, no matter how h*ckin good. Thank you... 13/10 would sneak a pat https://t.co/Se5fZ9wp5E","https://twitter.com/dog_rates/status/883117836046086144/photo/1,https://twitter.com/dog_rates/status/883117836046086144/photo/1",13.0,10,,,5819.0,33781.0,8960355.0
882992080364220416,2017-07-06 15:58:11+00:00,"<a href=""http://twitter.com/download/iphone"" rel=""nofollow"">Twitter for iPhone</a>",This is Rusty. He wasn't ready for the first pic. Clearly puppared for the second. 13/10 confirmed great boy https://t.co/tyER0KpdXj,"https://twitter.com/dog_rates/status/882992080364220416/photo/1,https://twitter.com/dog_rates/status/882992080364220416/photo/1",13.0,10,Rusty,,3399.0,21761.0,8960355.0
882762694511734784,2017-07-06 00:46:41+00:00,"<a href=""http://twitter.com/download/iphone"" rel=""nofollow"">Twitter for iPhone</a>",This is Gus. He's quite the cheeky pupper. Already perfected the disinterested wink. 12/10 would let steal my girl https://t.co/D43I96SlVu,https://twitter.com/dog_rates/status/882762694511734784/photo/1,12.0,10,Gus,pupper,4286.0,25729.0,8960355.0
882627270321602560,2017-07-05 15:48:34+00:00,"<a href=""http://twitter.com/download/iphone"" rel=""nofollow"">Twitter for iPhone</a>",This is Stanley. He has his first swim lesson today. Doggle straps adjusted. Ready to go. 13/10 Phelps is nervous (IG: stanleythe_corgi) https://t.co/Nx52PGwH94,https://twitter.com/dog_rates/status/882627270321602560/photo/1,13.0,10,Stanley,,5313.0,25546.0,8960355.0
882268110199369728,2017-07-04 16:01:23+00:00,"<a href=""http://twitter.com/download/iphone"" rel=""nofollow"">Twitter for iPhone</a>",This is Alfy. You're witnessing his first watermelon experience. I think it was a success. 13/10 happy 4th Alfy ðŸ‡ºðŸ‡¸ https://t.co/fYP5RlutfA,"https://twitter.com/dog_rates/status/882268110199369728/photo/1,https://twitter.com/dog_rates/status/882268110199369728/photo/1,https://twitter.com/dog_rates/status/882268110199369728/photo/1",13.0,10,Alfy,,10157.0,40796.0,8960355.0
882045870035918850,2017-07-04 01:18:17+00:00,"<a href=""http://twitter.com/download/iphone"" rel=""nofollow"">Twitter for iPhone</a>","This is Koko. Her owner, inspired by Barney, recently built a cart for her to use during walks if she got tired. 13/10 rest easy Koko https://t.co/zeDpnsKX7w","https://twitter.com/dog_rates/status/882045870035918850/photo/1,https://twitter.com/dog_rates/status/882045870035918850/photo/1,https://twitter.com/dog_rates/status/882045870035918850/photo/1,https://twitter.com/dog_rates/status/882045870035918850/photo/1",13.0,10,Koko,,4263.0,26702.0,8960355.0
881906580714921986,2017-07-03 16:04:48+00:00,"<a href=""http://twitter.com/download/iphone"" rel=""nofollow"">Twitter for iPhone</a>",This is Rey. He's a Benebop Cumberfloof. 12/10 dangerously pettable https://t.co/503CgWbhxQ,https://twitter.com/dog_rates/status/881906580714921986/photo/1,12.0,10,Rey,,2985.0,22201.0,8960355.0
881666595344535552,2017-07-03 00:11:11+00:00,"<a href=""http://twitter.com/download/iphone"" rel=""nofollow"">Twitter for iPhone</a>",This is Gary. He couldn't miss this puppertunity for a selfie. Flawless focusing skills. 13/10 would boop intensely https://t.co/7CSWCl8I6s,https://twitter.com/dog_rates/status/881666595344535552/photo/1,13.0,10,Gary,,9365.0,46173.0,8960834.0
881536004380872706,2017-07-02 15:32:16+00:00,"<a href=""http://twitter.com/download/iphone"" rel=""nofollow"">Twitter for iPhone</a>","Here is a pupper approaching maximum borkdrive. Zooming at never before seen speeds. 14/10 paw-inspiring af 
(IG: puffie_the_chow) https://t.co/ghXBIIeQZF",https://twitter.com/dog_rates/status/881536004380872706/video/1,14.0,10,,pupper,14051.0,45089.0,8960355.0
881268444196462592,2017-07-01 21:49:04+00:00,"<a href=""http://twitter.com/download/iphone"" rel=""nofollow"">Twitter for iPhone</a>",Meet Elliot. He's a Canadian Forrest Pup. Unusual number of antlers for a dog. Sneaky tongue slip to celebrate #Canada150. 12/10 would pet https://t.co/cgwJwowTMC,https://twitter.com/dog_rates/status/881268444196462592/photo/1,12.0,10,Elliot,,4659.0,21241.0,8960355.0
880935762899988482,2017-06-30 23:47:07+00:00,"<a href=""http://twitter.com/download/iphone"" rel=""nofollow"">Twitter for iPhone</a>",This is Louis. He's crossing. It's a big deal. 13/10 h*ckin breathtaking https://t.co/D0wb1GlKAt,https://twitter.com/dog_rates/status/880935762899988482/photo/1,13.0,10,Louis,,2449.0,15596.0,8960355.0
880872448815771648,2017-06-30 19:35:32+00:00,"<a href=""http://twitter.com/download/iphone"" rel=""nofollow"">Twitter for iPhone</a>",Ugh not again. We only rate dogs. Please don't send in well-dressed  floppy-tongued street penguins. Dogs only please. Thank you... 12/10 https://t.co/WiAMbTkDPf,https://twitter.com/dog_rates/status/880872448815771648/photo/1,12.0,10,,,3355.0,19421.0,8960355.0
880465832366813184,2017-06-29 16:39:47+00:00,"<a href=""http://twitter.com/download/iphone"" rel=""nofollow"">Twitter for iPhone</a>",This is Bella. She had her first beach experience this morning. Complete success. 12/10 would perform a sandy boop https://t.co/4VsFysDmiw,"https://twitter.com/dog_rates/status/880465832366813184/photo/1,https://twitter.com/dog_rates/status/880465832366813184/photo/1,https://twitter.com/dog_rates/status/880465832366813184/photo/1,https://twitter.com/dog_rates/status/880465832366813184/photo/1",12.0,10,Bella,,5458.0,25932.0,8960355.0
880221127280381952,2017-06-29 00:27:25+00:00,"<a href=""http://twitter.com/download/iphone"" rel=""nofollow"">Twitter for iPhone</a>",Meet Jesse. He's a Fetty Woof. His tongue ejects without warning. A true bleptomaniac. 12/10 would snug well https://t.co/fUod0tVmvK,"https://twitter.com/dog_rates/status/880221127280381952/photo/1,https://twitter.com/dog_rates/status/880221127280381952/photo/1",12.0,10,Jesse,,3643.0,24553.0,8960355.0
880095782870896641,2017-06-28 16:09:20+00:00,"<a href=""http://twitter.com/download/iphone"" rel=""nofollow"">Twitter for iPhone</a>",Please don't send in photos without dogs in them. We're not @porch_rates. Insubordinate and churlish. Pretty good porch tho 11/10 https://t.co/HauE8M3Bu4,https://twitter.com/dog_rates/status/880095782870896641/photo/1,11.0,10,,,3817.0,25184.0,8960355.0
879862464715927552,2017-06-28 00:42:13+00:00,"<a href=""http://twitter.com/download/iphone"" rel=""nofollow"">Twitter for iPhone</a>",This is Romeo. He would like to do an entrance. Requesting your immediate assistance. 13/10 https://t.co/Qh5aEkRQm9,"https://twitter.com/dog_rates/status/879862464715927552/photo/1,https://twitter.com/dog_rates/status/879862464715927552/photo/1,https://twitter.com/dog_rates/status/879862464715927552/photo/1",13.0,10,Romeo,,3057.0,20408.0,8960355.0
879492040517615616,2017-06-27 00:10:17+00:00,"<a href=""http://twitter.com/download/iphone"" rel=""nofollow"">Twitter for iPhone</a>",This is Bailey. He thinks you should measure ear length for signs of growth instead. 12/10 https://t.co/IxM9IMKQq8,https://twitter.com/dog_rates/status/879492040517615616/photo/1,12.0,10,Bailey,,2780.0,21434.0,8960355.0
879415818425184262,2017-06-26 19:07:24+00:00,"<a href=""http://twitter.com/download/iphone"" rel=""nofollow"">Twitter for iPhone</a>",This is Duddles. He did an attempt. 13/10 someone help him (vid by Georgia Felici) https://t.co/UDT7ZkcTgY,https://twitter.com/dog_rates/status/879415818425184262/video/1,13.0,10,Duddles,,39203.0,96341.0,8960355.0
879376492567855104,2017-06-26 16:31:08+00:00,"<a href=""http://twitter.com/download/iphone"" rel=""nofollow"">Twitter for iPhone</a>",This is Jack AKA Stephen Furry. You're not scoring on him. Unless he slips down the slide. 12/10 would happily get blocked by https://t.co/0gOi601EAa,https://twitter.com/dog_rates/status/879376492567855104/photo/1,12.0,10,Jack,,2747.0,15395.0,8960355.0
879050749262655488,2017-06-25 18:56:45+00:00,"<a href=""http://twitter.com/download/iphone"" rel=""nofollow"">Twitter for iPhone</a>",This is Steven. He has trouble relating to other dogs. Quite shy. Neck longer than average. Tropical probably. 11/10 would still pet https://t.co/2mJCDEJWdD,https://twitter.com/dog_rates/status/879050749262655488/photo/1,11.0,10,Steven,,4137.0,20583.0,8960355.0
879008229531029506,2017-06-25 16:07:47+00:00,"<a href=""http://twitter.com/download/iphone"" rel=""nofollow"">Twitter for iPhone</a>",This is Beau. That is Beau's balloon. He takes it everywhere. 13/10 would protect at all costs https://t.co/YDtpCjIPKN,https://twitter.com/dog_rates/status/879008229531029506/photo/1,13.0,10,Beau,,2354.0,17360.0,8960355.0
