tweet_id,timestamp,source,text,expanded_urls,rating_numerator,rating_denominator,name,dog_breed,retweet_count,favorite_count,user_count
678255464182861824,2015-12-19 16:47:58+00:00,"<a href=""http://twitter.com/download/iphone"" rel=""nofollow"">Twitter for iPhone</a>",This is Jessifer. She is a Bismoth Teriyaki. Flowers being attacked by hurricanes on bandana (rad). 9/10 stellar pup https://t.co/nZhmRwZzWv,https://twitter.com/dog_rates/status/678255464182861824/photo/1,9.0,10,Jessifer,,348.0,1517.0,8960375.0
678021115718029313,2015-12-19 01:16:45+00:00,"<a href=""http://twitter.com/download/iphone"" rel=""nofollow"">Twitter for iPhone</a>",This is Reese. He likes holding hands. 12/10 https://t.co/cbLroGCbmh,https://twitter.com/dog_rates/status/678021115718029313/photo/1,12.0,10,Reese,,5968.0,12964.0,8960375.0
677918531514703872,2015-12-18 18:29:07+00:00,"<a href=""http://twitter.com/download/iphone"" rel=""nofollow"">Twitter for iPhone</a>","""Everything looks pretty good in there. Make sure to brush your gums. Been flossing? How's school going?"" Both 10/10 https://t.co/lWL2IMJqLR",https://twitter.com/dog_rates/status/677918531514703872/photo/1,10.0,10,,,385.0,1276.0,8960375.0
677895101218201600,2015-12-18 16:56:01+00:00,"<a href=""http://twitter.com/download/iphone"" rel=""nofollow"">Twitter for iPhone</a>",Guys this was terrifying. Really spooked me up. We don't rate ghosts. We rate dogs. Please only send dogs... 9/10 https://t.co/EJImi1udYb,https://twitter.com/dog_rates/status/677895101218201600/photo/1,9.0,10,,,1957.0,4592.0,8960375.0
677716515794329600,2015-12-18 05:06:23+00:00,"<a href=""http://twitter.com/download/iphone"" rel=""nofollow"">Twitter for iPhone</a>",IT'S PUPPERGEDDON. Total of 144/120 ...I think https://t.co/ZanVtAtvIq,https://twitter.com/dog_rates/status/677716515794329600/photo/1,144.0,10,,,924.0,2900.0,8960375.0
677700003327029250,2015-12-18 04:00:46+00:00,"<a href=""http://twitter.com/download/iphone"" rel=""nofollow"">Twitter for iPhone</a>",This is Ralph. He's an interpretive dancer. 10/10 https://t.co/zoDdPyPFsa,https://twitter.com/dog_rates/status/677700003327029250/photo/1,10.0,10,Ralph,,1366.0,3227.0,8960375.0
677698403548192770,2015-12-18 03:54:25+00:00,"<a href=""http://twitter.com/download/iphone"" rel=""nofollow"">Twitter for iPhone</a>",This is Sadie. She got her holidays confused. 9/10 damn it Sadie https://t.co/fm7HxOsuPK,https://twitter.com/dog_rates/status/677698403548192770/photo/1,9.0,10,Sadie,,304.0,1173.0,8960375.0
677687604918272002,2015-12-18 03:11:30+00:00,"<a href=""http://twitter.com/download/iphone"" rel=""nofollow"">Twitter for iPhone</a>",This was Cindy's face when she heard Susan forgot the snacks for after the kid's soccer game. 11/10 https://t.co/gzkuVGRgAD,https://twitter.com/dog_rates/status/677687604918272002/photo/1,11.0,10,,,798.0,2381.0,8960375.0
677673981332312066,2015-12-18 02:17:22+00:00,"<a href=""http://twitter.com/download/iphone"" rel=""nofollow"">Twitter for iPhone</a>",Endangered triangular pup here. Could be a wizard. Caught mid-laugh. No legs. Just fluff. Probably a wizard. 9/10 https://t.co/GFVIHIod0Z,https://twitter.com/dog_rates/status/677673981332312066/photo/1,9.0,10,,,1419.0,3168.0,8960375.0
677662372920729601,2015-12-18 01:31:14+00:00,"<a href=""http://twitter.com/download/iphone"" rel=""nofollow"">Twitter for iPhone</a>","In honor of the new Star Wars movie. Here's Yoda pug. 12/10 pet really well, would I https://t.co/pvjdRn00XH",https://twitter.com/dog_rates/status/677662372920729601/photo/1,12.0,10,,,894.0,1852.0,8960375.0
677644091929329666,2015-12-18 00:18:36+00:00,"<a href=""http://twitter.com/download/iphone"" rel=""nofollow"">Twitter for iPhone</a>",This is a dog swinging. I really enjoyed it so I hope you all do as well. 11/10 https://t.co/Ozo9KHTRND,https://twitter.com/dog_rates/status/677644091929329666/video/1,11.0,10,,,764.0,1774.0,8960375.0
677573743309385728,2015-12-17 19:39:03+00:00,"<a href=""http://twitter.com/download/iphone"" rel=""nofollow"">Twitter for iPhone</a>",This is Sandy. He's sexually confused. Thinks he's a pigeon. Also an All-American cheese catcher. 10/10 so petable https://t.co/Htu8plSqEu,"https://twitter.com/dog_rates/status/677573743309385728/photo/1,https://twitter.com/dog_rates/status/677573743309385728/photo/1",10.0,10,Sandy,,659.0,2038.0,8960375.0
677565715327688705,2015-12-17 19:07:09+00:00,"<a href=""http://twitter.com/download/iphone"" rel=""nofollow"">Twitter for iPhone</a>",Contortionist pup here. Inside pentagram. Clearly worships Satan. Known to slowly push fragile stuff off tables 6/10 https://t.co/EX9oR55VMe,https://twitter.com/dog_rates/status/677565715327688705/photo/1,6.0,10,,,435.0,1241.0,8960375.0
677557565589463040,2015-12-17 18:34:46+00:00,"<a href=""http://twitter.com/download/iphone"" rel=""nofollow"">Twitter for iPhone</a>",Reckless pupper here. Not even looking at road. Absolute menace. No regard for fellow pupper lives. 10/10 still cute https://t.co/96IBkOYB7j,https://twitter.com/dog_rates/status/677557565589463040/photo/1,10.0,10,,pupper,1093.0,2334.0,8960375.0
677547928504967168,2015-12-17 17:56:29+00:00,"<a href=""http://twitter.com/download/iphone"" rel=""nofollow"">Twitter for iPhone</a>",Not much to say here. I just think everyone needs to see this. 12/10 https://t.co/AGag0hFHpe,https://twitter.com/dog_rates/status/677547928504967168/photo/1,12.0,10,,,3476.0,6601.0,8960375.0
677530072887205888,2015-12-17 16:45:31+00:00,"<a href=""http://twitter.com/download/iphone"" rel=""nofollow"">Twitter for iPhone</a>",Say hello to Axel. He's a Black Chevy Pinot on wheels. 0 to 60 in 5.7 seconds (if downhill). 9/10 I call shotgun https://t.co/DKe9DBnnHE,https://twitter.com/dog_rates/status/677530072887205888/photo/1,9.0,10,Axel,,217.0,1018.0,8960375.0
677334615166730240,2015-12-17 03:48:51+00:00,"<a href=""http://twitter.com/download/iphone"" rel=""nofollow"">Twitter for iPhone</a>",This dog gave up mid jump. 9/10 https://t.co/KmMv3Y2zI8,"https://twitter.com/dog_rates/status/677334615166730240/photo/1,https://twitter.com/dog_rates/status/677334615166730240/photo/1",9.0,10,,,269.0,1281.0,8960854.0
677331501395156992,2015-12-17 03:36:28+00:00,"<a href=""http://twitter.com/download/iphone"" rel=""nofollow"">Twitter for iPhone</a>",Meet Humphrey. He's a Northern Polyp Viagra. One ear works. Face stuck like that. Always surprised. 9/10 petable af https://t.co/FS7eJQM2F4,https://twitter.com/dog_rates/status/677331501395156992/photo/1,9.0,10,Humphrey,,222.0,1037.0,8960375.0
677328882937298944,2015-12-17 03:26:04+00:00,"<a href=""http://twitter.com/download/iphone"" rel=""nofollow"">Twitter for iPhone</a>",This is Derek. All the dogs adore Derek. He's a great guy. 10/10 really solid pup https://t.co/KgcsGNb61s,https://twitter.com/dog_rates/status/677328882937298944/photo/1,10.0,10,Derek,,1424.0,3486.0,8960375.0
677314812125323265,2015-12-17 02:30:09+00:00,"<a href=""http://twitter.com/download/iphone"" rel=""nofollow"">Twitter for iPhone</a>","Meet Tassy &amp; Bee. Tassy is pretty chill, but Bee is convinced the Ruffles are haunted. 10/10 &amp; 11/10 respectively https://t.co/fgORpmTN9C","https://twitter.com/dog_rates/status/677314812125323265/photo/1,https://twitter.com/dog_rates/status/677314812125323265/photo/1",10.0,10,Tassy,,504.0,1573.0,8960375.0
677301033169788928,2015-12-17 01:35:24+00:00,"<a href=""http://twitter.com/download/iphone"" rel=""nofollow"">Twitter for iPhone</a>",This is Juckson. He's totally on his way to a nascar race. 5/10 for Juckson https://t.co/IoLRvF0Kak,https://twitter.com/dog_rates/status/677301033169788928/photo/1,5.0,10,Juckson,,382.0,1170.0,8960375.0
677269281705472000,2015-12-16 23:29:14+00:00,"<a href=""http://twitter.com/download/iphone"" rel=""nofollow"">Twitter for iPhone</a>",This is the happiest pupper I've ever seen. 10/10 would trade lives with https://t.co/ep8ATEJwRb,https://twitter.com/dog_rates/status/677269281705472000/photo/1,10.0,10,the,pupper,670.0,1879.0,8960375.0
677228873407442944,2015-12-16 20:48:40+00:00,"<a href=""http://twitter.com/download/iphone"" rel=""nofollow"">Twitter for iPhone</a>",Say hello to Chuq. He just wants to fit in. 11/10 https://t.co/hGkMCjZzn4,https://twitter.com/dog_rates/status/677228873407442944/photo/1,11.0,10,Chuq,,1551.0,3377.0,8960375.0
677187300187611136,2015-12-16 18:03:28+00:00,"<a href=""http://twitter.com/download/iphone"" rel=""nofollow"">Twitter for iPhone</a>",Here we see a Byzantine Rigatoni. Very aerodynamic. No eyes. Actually not windy here they just look like that. 9/10 https://t.co/gzI0m6wXRo,https://twitter.com/dog_rates/status/677187300187611136/photo/1,9.0,10,,,859.0,2592.0,8960375.0
676975532580409345,2015-12-16 04:01:59+00:00,"<a href=""http://twitter.com/download/iphone"" rel=""nofollow"">Twitter for iPhone</a>",This is Cooper. He doesn't know how cheese works. Likes the way it feels on his face. Cheeky tongue slip. 11/10 https://t.co/j1zczS0lI5,https://twitter.com/dog_rates/status/676975532580409345/photo/1,11.0,10,Cooper,,1010.0,2637.0,8960383.0
676957860086095872,2015-12-16 02:51:45+00:00,"<a href=""http://twitter.com/download/iphone"" rel=""nofollow"">Twitter for iPhone</a>",10/10 I'd follow this dog into battle no questions asked https://t.co/ngTNXYQF0L,https://twitter.com/dog_rates/status/676957860086095872/video/1,10.0,10,,,769.0,2130.0,8960383.0
676949632774234114,2015-12-16 02:19:04+00:00,"<a href=""http://twitter.com/download/iphone"" rel=""nofollow"">Twitter for iPhone</a>",This is Tyrus. He's a Speckled Centennial Ticonderoga. Terrified of floating red ball. Nifty bandana. 8/10 v petable https://t.co/HqM3YhCaaa,https://twitter.com/dog_rates/status/676949632774234114/photo/1,8.0,10,Tyrus,,372.0,1246.0,8960383.0
676948236477857792,2015-12-16 02:13:31+00:00,"<a href=""http://twitter.com/download/iphone"" rel=""nofollow"">Twitter for iPhone</a>",This is Karl. Karl thinks he's slick. 6/10 sneaky pup https://t.co/Lo4ALwjVh4,https://twitter.com/dog_rates/status/676948236477857792/photo/1,6.0,10,Karl,,812.0,2052.0,8960383.0
676946864479084545,2015-12-16 02:08:04+00:00,"<a href=""http://twitter.com/download/iphone"" rel=""nofollow"">Twitter for iPhone</a>",This pups goal was to get all four feet as close to each other as possible. Valiant effort 12/10 https://t.co/2mXALbgBTV,https://twitter.com/dog_rates/status/676946864479084545/photo/1,12.0,10,,,344.0,1648.0,8960383.0
676942428000112642,2015-12-16 01:50:26+00:00,"<a href=""http://twitter.com/download/iphone"" rel=""nofollow"">Twitter for iPhone</a>",Who leaves the last cupcake just sitting there? 9/10 https://t.co/PWMqAoEx2a,https://twitter.com/dog_rates/status/676942428000112642/photo/1,9.0,10,,,704.0,1967.0,8960383.0
676936541936185344,2015-12-16 01:27:03+00:00,"<a href=""http://twitter.com/download/iphone"" rel=""nofollow"">Twitter for iPhone</a>",Here we see a rare pouched pupper. Ample storage space. Looks alert. Jumps at random. Kicked open that door. 8/10 https://t.co/mqvaxleHRz,https://twitter.com/dog_rates/status/676936541936185344/photo/1,8.0,10,,pupper,4674.0,12103.0,8960383.0
676897532954456065,2015-12-15 22:52:02+00:00,"<a href=""http://twitter.com/download/iphone"" rel=""nofollow"">Twitter for iPhone</a>",Exotic handheld dog here. Appears unathletic. Feet look deadly. Can be thrown a great distance. 5/10 might pet idk https://t.co/Avq4awulqk,https://twitter.com/dog_rates/status/676897532954456065/photo/1,5.0,10,,,687.0,2133.0,8960383.0
676864501615042560,2015-12-15 20:40:47+00:00,"<a href=""http://twitter.com/download/iphone"" rel=""nofollow"">Twitter for iPhone</a>",Meet Ash. He's just a head now. Lost his body during the Third Crusade. Still in good spirits. 10/10 would pet well https://t.co/NJj2uP0atK,https://twitter.com/dog_rates/status/676864501615042560/photo/1,10.0,10,Ash,,662.0,1983.0,8960383.0
676821958043033607,2015-12-15 17:51:44+00:00,"<a href=""http://twitter.com/download/iphone"" rel=""nofollow"">Twitter for iPhone</a>",Finally some constructive political change in this country. 11/10 https://t.co/mvQaETHVSb,"https://twitter.com/dog_rates/status/676821958043033607/photo/1,https://twitter.com/dog_rates/status/676821958043033607/photo/1",11.0,10,,,14607.0,21709.0,8960383.0
676819651066732545,2015-12-15 17:42:34+00:00,"<a href=""http://twitter.com/download/iphone"" rel=""nofollow"">Twitter for iPhone</a>",Watch out Airbud. This pupper is also good at the sports. 12/10 I'm thinking D1 https://t.co/1HrFdo7M0C,"https://twitter.com/dog_rates/status/676819651066732545/photo/1,https://twitter.com/dog_rates/status/676819651066732545/photo/1",12.0,10,,pupper,625.0,1730.0,8960383.0
676811746707918848,2015-12-15 17:11:09+00:00,"<a href=""http://twitter.com/download/iphone"" rel=""nofollow"">Twitter for iPhone</a>",Say hello to Penny &amp; Gizmo. They are practicing their caroling. The ambition in the room is tangible. 9/10 for both https://t.co/aqBHjjh5VD,https://twitter.com/dog_rates/status/676811746707918848/photo/1,9.0,10,Penny,,405.0,1359.0,8960383.0
676776431406465024,2015-12-15 14:50:49+00:00,"<a href=""http://twitter.com/download/iphone"" rel=""nofollow"">Twitter for iPhone</a>","When someone yells ""cops!"" at a party and you gotta get your drunk friend out of there. 10/10 https://t.co/4rMZi5Ca1k",https://twitter.com/dog_rates/status/676776431406465024/video/1,10.0,10,,,1909.0,4745.0,8960383.0
676617503762681856,2015-12-15 04:19:18+00:00,"<a href=""http://twitter.com/download/iphone"" rel=""nofollow"">Twitter for iPhone</a>",I promise this wasn't meant to be a cuteness overload account but ermergerd look at this cozy pupper. 13/10 https://t.co/mpQl2rJjDh,https://twitter.com/dog_rates/status/676617503762681856/photo/1,13.0,10,,pupper,900.0,2731.0,8960383.0
676613908052996102,2015-12-15 04:05:01+00:00,"<a href=""http://twitter.com/download/iphone"" rel=""nofollow"">Twitter for iPhone</a>",This is the saddest/sweetest/best picture I've been sent. 12/10 ðŸ˜¢ðŸ¶ https://t.co/vQ2Lw1BLBF,https://twitter.com/dog_rates/status/676613908052996102/photo/1,12.0,10,the,,188.0,1032.0,8960383.0
676606785097199616,2015-12-15 03:36:42+00:00,"<a href=""http://twitter.com/download/iphone"" rel=""nofollow"">Twitter for iPhone</a>",*screeches for a sec and then faints* 12/10 https://t.co/N5QL4ySBEx,https://twitter.com/dog_rates/status/676606785097199616/photo/1,12.0,10,,,409.0,1806.0,8960383.0
676603393314578432,2015-12-15 03:23:14+00:00,"<a href=""http://twitter.com/download/iphone"" rel=""nofollow"">Twitter for iPhone</a>",This is Godzilla pupper. He had a ruff childhood &amp; now deflects that pain outward by terrorizing cities. Tragic 9/10 https://t.co/g1tLGkyaxr,https://twitter.com/dog_rates/status/676603393314578432/photo/1,9.0,10,Godzilla,pupper,360.0,1103.0,8960383.0
676588346097852417,2015-12-15 02:23:26+00:00,"<a href=""http://twitter.com/download/iphone"" rel=""nofollow"">Twitter for iPhone</a>",This is Bubbles. He kinda resembles a fish. Always makes eye contact with u no matter what. Sneaky tongue slip. 5/10 https://t.co/Nrhvc5tLFT,https://twitter.com/dog_rates/status/676588346097852417/photo/1,5.0,10,Bubbles,,736.0,2191.0,8960383.0
676582956622721024,2015-12-15 02:02:01+00:00,"<a href=""http://twitter.com/download/iphone"" rel=""nofollow"">Twitter for iPhone</a>","Meet Vinnie. He's having fun while being safe. Well not a lot of fun, but definitely safe, and that's important 8/10 https://t.co/vZYtynZZlH",https://twitter.com/dog_rates/status/676582956622721024/photo/1,8.0,10,Vinnie,,256.0,1128.0,8960383.0
676575501977128964,2015-12-15 01:32:24+00:00,"<a href=""http://twitter.com/download/iphone"" rel=""nofollow"">Twitter for iPhone</a>",This pupper is very passionate about Christmas. Wanted to give the tree a hug. So cute. 8/10 https://t.co/NsGyECJuq7,https://twitter.com/dog_rates/status/676575501977128964/photo/1,8.0,10,,pupper,1052.0,2439.0,8960383.0
676533798876651520,2015-12-14 22:46:41+00:00,"<a href=""http://twitter.com/download/iphone"" rel=""nofollow"">Twitter for iPhone</a>",ITSOFLUFFAYYYYY 12/10 https://t.co/bfw13CnuuZ,https://twitter.com/dog_rates/status/676533798876651520/photo/1,12.0,10,,,519.0,1782.0,8960383.0
676496375194980353,2015-12-14 20:17:59+00:00,"<a href=""http://twitter.com/download/iphone"" rel=""nofollow"">Twitter for iPhone</a>",Say hello to Griffin. He's upset because his costume for Halloween didn't arrive until today. 9/10 cheer up pup https://t.co/eoBCjSFajX,https://twitter.com/dog_rates/status/676496375194980353/photo/1,9.0,10,Griffin,,501.0,1449.0,8960383.0
676470639084101634,2015-12-14 18:35:43+00:00,"<a href=""http://twitter.com/download/iphone"" rel=""nofollow"">Twitter for iPhone</a>",Three generations of pupper. 11/10 for all https://t.co/tAmQYvzrau,https://twitter.com/dog_rates/status/676470639084101634/photo/1,11.0,10,,pupper,4408.0,11042.0,8960383.0
676440007570247681,2015-12-14 16:34:00+00:00,"<a href=""http://twitter.com/download/iphone"" rel=""nofollow"">Twitter for iPhone</a>",Hope your Monday isn't too awful. Here's two baseball puppers. 11/10 for each https://t.co/dB0H9hdZai,"https://twitter.com/dog_rates/status/676440007570247681/photo/1,https://twitter.com/dog_rates/status/676440007570247681/photo/1",11.0,10,,,620.0,1636.0,8960383.0
676430933382295552,2015-12-14 15:57:56+00:00,"<a href=""http://twitter.com/download/iphone"" rel=""nofollow"">Twitter for iPhone</a>","Meet Duke. He's an Urban Parmesan. They know he's scared of the green rubber dog. ""Why u do dis?"" thinks Duke. 10/10 https://t.co/3bim9U5Idr",https://twitter.com/dog_rates/status/676430933382295552/photo/1,10.0,10,Duke,,319.0,1329.0,8960383.0
676263575653122048,2015-12-14 04:52:55+00:00,"<a href=""http://twitter.com/download/iphone"" rel=""nofollow"">Twitter for iPhone</a>",All this pupper wanted to do was go skiing. No one told him about the El NiÃ±o. Poor pupper. 10/10 maybe next year https://t.co/fTgbq1UBR9,https://twitter.com/dog_rates/status/676263575653122048/photo/1,10.0,10,,pupper,507.0,1982.0,8960383.0
676237365392908289,2015-12-14 03:08:46+00:00,"<a href=""http://twitter.com/download/iphone"" rel=""nofollow"">Twitter for iPhone</a>",Say hello to Winston. He has no respect for the system. Much rebellion. I think that's a palm tree... nice. 8/10 https://t.co/dOLQddhXLZ,https://twitter.com/dog_rates/status/676237365392908289/photo/1,8.0,10,Winston,,265.0,1145.0,8960383.0
676219687039057920,2015-12-14 01:58:31+00:00,"<a href=""http://twitter.com/download/iphone"" rel=""nofollow"">Twitter for iPhone</a>",This is Kenneth. He's stuck in a bubble. 10/10 hang in there Kenneth https://t.co/uQt37xlYMJ,https://twitter.com/dog_rates/status/676219687039057920/photo/1,10.0,10,Kenneth,,29191.0,72548.0,8960383.0
676215927814406144,2015-12-14 01:43:35+00:00,"<a href=""http://twitter.com/download/iphone"" rel=""nofollow"">Twitter for iPhone</a>",This is Herm. He just wants to be like the other dogs. Sneaky tongue slip. Super fuzzy. 9/10 would cuddle firmly https://t.co/tg8h9lzCHv,https://twitter.com/dog_rates/status/676215927814406144/photo/1,9.0,10,Herm,,540.0,1643.0,8960383.0
676191832485810177,2015-12-14 00:07:50+00:00,"<a href=""http://twitter.com/download/iphone"" rel=""nofollow"">Twitter for iPhone</a>",These two pups just met and have instantly bonded. Spectacular scene. Mesmerizing af. 10/10 and 7/10 for blue dog https://t.co/gwryaJO4tC,"https://twitter.com/dog_rates/status/676191832485810177/photo/1,https://twitter.com/dog_rates/status/676191832485810177/photo/1,https://twitter.com/dog_rates/status/676191832485810177/photo/1",10.0,10,,,972.0,2150.0,8960383.0
676146341966438401,2015-12-13 21:07:04+00:00,"<a href=""http://twitter.com/download/iphone"" rel=""nofollow"">Twitter for iPhone</a>",This is Bert. He likes flowers. 10/10 https://t.co/lmQRrNxaQu,https://twitter.com/dog_rates/status/676146341966438401/photo/1,10.0,10,Bert,,626.0,1819.0,8960383.0
676101918813499392,2015-12-13 18:10:33+00:00,"<a href=""http://twitter.com/download/iphone"" rel=""nofollow"">Twitter for iPhone</a>",Meet Striker. He's ready for Christmas. 11/10 https://t.co/B3xxSLjQSH,https://twitter.com/dog_rates/status/676101918813499392/photo/1,11.0,10,Striker,,1101.0,2681.0,8960383.0
676098748976615425,2015-12-13 17:57:57+00:00,"<a href=""http://twitter.com/download/iphone"" rel=""nofollow"">Twitter for iPhone</a>",Extremely rare pup here. Very religious. Always praying. Too many legs. Not overwhelmingly fluffy. Won't bark. 3/10 https://t.co/REyE5YKVBb,https://twitter.com/dog_rates/status/676098748976615425/photo/1,3.0,10,,,1319.0,2829.0,8960383.0
676089483918516224,2015-12-13 17:21:08+00:00,"<a href=""http://twitter.com/download/iphone"" rel=""nofollow"">Twitter for iPhone</a>","""Yes hello I'ma just snag this here toasted bagel real quick. carry on."" 9/10 https://t.co/Cuz0Osnekp",https://twitter.com/dog_rates/status/676089483918516224/photo/1,9.0,10,,,411.0,1240.0,8960383.0
675898130735476737,2015-12-13 04:40:46+00:00,"<a href=""http://twitter.com/download/iphone"" rel=""nofollow"">Twitter for iPhone</a>",I'm sure you've all seen this pupper. Not prepared at all for the flying disc of terror. 10/10 https://t.co/G0pQiFGM7O,https://twitter.com/dog_rates/status/675898130735476737/photo/1,10.0,10,,pupper,531.0,1528.0,8960383.0
675891555769696257,2015-12-13 04:14:39+00:00,"<a href=""http://twitter.com/download/iphone"" rel=""nofollow"">Twitter for iPhone</a>",This is Donny. He's summoning the demon monster Babadook. 6/10 Donny please no that won't be a good time for anyone https://t.co/kiW6Knb7Gp,https://twitter.com/dog_rates/status/675891555769696257/photo/1,6.0,10,Donny,,804.0,2009.0,8960383.0
675888385639251968,2015-12-13 04:02:03+00:00,"<a href=""http://twitter.com/download/iphone"" rel=""nofollow"">Twitter for iPhone</a>",Breathtaking scene. A father taking care of his newborn pup. Tugs at the heartstrings. 10/10 restores my faith https://t.co/06oZdehGEa,https://twitter.com/dog_rates/status/675888385639251968/photo/1,10.0,10,,,889.0,2248.0,8960383.0
675878199931371520,2015-12-13 03:21:34+00:00,"<a href=""http://twitter.com/download/iphone"" rel=""nofollow"">Twitter for iPhone</a>","Ok, I'll admit this is a pretty adorable bunny hopping towards the ocean but please only send in dogs... 11/10 https://t.co/sfsVCGIipI",https://twitter.com/dog_rates/status/675878199931371520/photo/1,11.0,10,,,1314.0,3949.0,8960383.0
675853064436391936,2015-12-13 01:41:41+00:00,"<a href=""http://twitter.com/download/iphone"" rel=""nofollow"">Twitter for iPhone</a>",Here we have an entire platoon of puppers. Total score: 88/80 would pet all at once https://t.co/y93p6FLvVw,"https://twitter.com/dog_rates/status/675853064436391936/photo/1,https://twitter.com/dog_rates/status/675853064436391936/photo/1",88.0,10,,,1201.0,2547.0,8960383.0
675845657354215424,2015-12-13 01:12:15+00:00,"<a href=""http://twitter.com/download/iphone"" rel=""nofollow"">Twitter for iPhone</a>","This is Pepper. She's not fully comfortable riding her imaginary bike yet. 10/10 don't worry pupper, it gets easier https://t.co/40dj4eTsXG",https://twitter.com/dog_rates/status/675845657354215424/photo/1,10.0,10,Pepper,pupper,819.0,2144.0,8960383.0
675822767435051008,2015-12-12 23:41:18+00:00,"<a href=""http://twitter.com/download/iphone"" rel=""nofollow"">Twitter for iPhone</a>",ðŸŽ¶ HELLO FROM THE OTHER SIIIIIIIIDE ðŸŽ¶ 10/10s https://t.co/GK2HJtkdQk,https://twitter.com/dog_rates/status/675822767435051008/photo/1,10.0,10,,,505.0,1438.0,8960383.0
675820929667219457,2015-12-12 23:34:00+00:00,"<a href=""http://twitter.com/download/iphone"" rel=""nofollow"">Twitter for iPhone</a>",Here's a handful of sleepy puppers. All look unaware of their surroundings. Lousy guard dogs. Still cute tho 11/10s https://t.co/lyXX3v5j4s,https://twitter.com/dog_rates/status/675820929667219457/photo/1,11.0,10,,,224.0,989.0,8960383.0
675798442703122432,2015-12-12 22:04:39+00:00,"<a href=""http://twitter.com/download/iphone"" rel=""nofollow"">Twitter for iPhone</a>",This is Bernie. He just touched a boob for the first time. 10/10 https://t.co/whQKMygnK6,https://twitter.com/dog_rates/status/675798442703122432/photo/1,10.0,10,Bernie,,3210.0,9694.0,8960383.0
675781562965868544,2015-12-12 20:57:34+00:00,"<a href=""http://twitter.com/download/iphone"" rel=""nofollow"">Twitter for iPhone</a>",Say hello to Buddah. He was Waldo for Halloween. 11/10 https://t.co/DVAqAnb624,https://twitter.com/dog_rates/status/675781562965868544/photo/1,11.0,10,Buddah,,438.0,1534.0,8960383.0
675740360753160193,2015-12-12 18:13:51+00:00,"<a href=""http://twitter.com/download/iphone"" rel=""nofollow"">Twitter for iPhone</a>",Here's a pupper licking in slow motion. 12/10 please enjoy https://t.co/AUJi8ujxw9,https://twitter.com/dog_rates/status/675740360753160193/video/1,12.0,10,,pupper,318.0,1109.0,8960383.0
675710890956750848,2015-12-12 16:16:45+00:00,"<a href=""http://twitter.com/download/iphone"" rel=""nofollow"">Twitter for iPhone</a>",This is Lenny. He was just told that he couldn't explore the fish tank. 12/10 smh all that work for nothing https://t.co/JWi6YrpiO1,"https://twitter.com/dog_rates/status/675710890956750848/photo/1,https://twitter.com/dog_rates/status/675710890956750848/photo/1",12.0,10,Lenny,,764.0,1775.0,8960383.0
675706639471788032,2015-12-12 15:59:51+00:00,"<a href=""http://twitter.com/download/iphone"" rel=""nofollow"">Twitter for iPhone</a>",This is a Sizzlin Menorah spaniel from Brooklyn named Wylie. Lovable eyes. Chiller as hell. 10/10 and I'm out.. poof https://t.co/7E0AiJXPmI,https://twitter.com/dog_rates/status/675706639471788032/photo/1,10.0,10,Wylie,,87.0,614.0,8960383.0
675534494439489536,2015-12-12 04:35:48+00:00,"<a href=""http://twitter.com/download/iphone"" rel=""nofollow"">Twitter for iPhone</a>",Seriously guys?! Only send in dogs. I only rate dogs. This is a baby black bear... 11/10 https://t.co/H7kpabTfLj,https://twitter.com/dog_rates/status/675534494439489536/photo/1,11.0,10,,,382.0,1742.0,8960383.0
